id,user_name,rating,review_text,uploaded_at,image,order_id,user_email
1,Caroline Thalia,2,"Finally found a jewellery brand that can represent my life and affordable!!",2025-05-25 05:12:43.205737,review_images/people1_yRV3fRS.jpeg,,
2,Nadia,5,"The Timeless Elegance Studs are exactly what I was looking for! They’re simple, classy, and go with everything. I’ve worn them to both casual outings and formal events, and they always add the perfect touch of elegance. The quality is amazing, and they still look brand new even after daily wear. Definitely my new favorite earrings!",2025-05-25 05:13:28.957162,review_images/people3.jpeg,,
3,Okta R.,5,"Finally found a brand that can combine the charm my grandma gave me and their cat charm is cute too!! Totally loves it!",2025-05-25 05:26:18.258058,review_images/people2.jpeg,,
4,Gabriel,5,"I took my Sparklore bracelet and ring to the beach, and it held up beautifully! The charms didn’t tarnish, and the quality is incredible—even after being exposed to sun and saltwater. It’s my new favorite piece, and I love how personal it feels. Definitely a must-have for any jewellery lover!",2025-05-25 05:27:00.711911,review_images/2547d834de6fe17cd37245e924b29a2125dc0d94.jpg,,
5,Caroline F,5,"I bought the Love Chain Bracelet, and it’s absolutely stunning! The design is so delicate yet durable, and it fits perfectly. I wore it on a special date night and got so many compliments. It truly feels like a meaningful piece, and I love that I could customize it with my favorite charms. Can’t wait to buy more from SparkLore!",2025-05-25 05:27:40.455531,review_images/45960bbb7c01783a89b92b31203c40ce9dc8ea25.jpg,,
6,Kezia E,5,"I absolutely love my custom bracelet from Sparklore! The charm selection process was so fun and easy, and the final piece is even more beautiful than I imagined. The quality is amazing, and it feels so personal to me. I’ve already received so many compliments! Definitely ordering again!",2025-05-25 05:27:58.453426,review_images/949f5fa713a6b0cdac9d6563a6fd43c63b33e090.jpg,,
7,Gine,5,"Finally found a jewellery brand that can represent my life and affordable!!,2025-05-25 05:28:44.905571,review_images/0f20bef418077895c4348a0abf5b605db4bd32d0.png,,